[
  {
    "id": 1,
    "image": "/images/data-logo-1.svg",
    "title": "Software Developer Intern",
    "company": "TechXcel Philippines",
    "location": "Metro Manila, Philippines",
    "role": "Software Development",
    "work_setup": "Onsite",
    "compensation": "Paid",
    "rate": "120/hr",
    "description": "Empowering Innovation, Elevating Technology. We are a visionary tech company committed to delivering cutting-edge solutions and exceptional services. Our mission is to drive innovation and elevate the possibilities in the ever-evolving landscape of technology.\n\nAt the core of our values is a commitment to excellence, where we strive to exceed expectations and create transformative experiences for our clients. Through a combination of creativity, expertise, and forward-thinking strategies, we embark on a journey to redefine the standards of technological achievement.\n\nOur dedicated team of professionals is passionate about solving complex challenges and turning ideas into reality. We foster a collaborative environment that encourages ingenuity, allowing us to pioneer solutions that make a lasting impact. As we navigate the dynamic realm of technology, we remain dedicated to empowering businesses, individuals, and communities through the possibilities that our innovative solutions unlock.\n\nIn a world driven by digital transformation, we stand as a beacon of progress, embodying the spirit of innovation that propels us forward. Join us on this journey, where empowerment and elevation converge to shape a future where technology knows no bounds.",
    "featured": true
  },
  {
    "image": "/images/data-logo-2.svg",
    "title": "Data Science Intern",
    "company": "InnovateTech Solutions Inc.",
    "location": "Silicon Valley, California, USA",
    "role": "Data Science",
    "work_setup": "Python",
    "compensation": "Paid",
    "rate": "240/hr",
    "description": "Join InnovateTech Solutions Inc. as a Data Science Intern and immerse yourself in the world of cutting-edge technology and innovation. As a part of our dynamic team in the heart of Silicon Valley, you will have the opportunity to work on impactful data science projects, leveraging your skills in Python and machine learning.\n\nWhat you'll be doing:\n- Collaborating with our experienced data science team on real-world projects\n- Applying Python programming skills to analyze and interpret data\n- Building and implementing machine learning models\n- Contributing to the development of data-driven solutions\n- Participating in data exploration and visualization\n\nWho we're looking for:\n- Enthusiastic individuals with a passion for data science\n- Students or recent graduates in computer science, data science, or a related field\n- Proficiency in Python programming and machine learning concepts\n- Strong analytical and problem-solving skills\n\nThis is a paid internship position with a competitive compensation of $240 per hour. If you are ready to take on the challenges of data science and contribute to groundbreaking projects, apply now and be a key player in shaping the future of data innovation at InnovateTech Solutions Inc.",
    "skill_requirements": ["Python", "Machine Learning"],
    "featured": true
  },
  {
    "id": 3,
    "image": "/images/data-logo-3.svg",
    "title": "Digital Marketing Intern",
    "company": "GrowthHub Solutions PH",
    "location": "Quezon City, Philippines",
    "role": "Digital Marketing",
    "work_setup": "Remote",
    "compensation": "Paid",
    "rate": "85/hr",
    "description": "Join GrowthHub Solutions PH as a Digital Marketing Intern and embark on a journey to explore the dynamic field of digital marketing. As a member of our team, you will have the opportunity to gain hands-on experience in executing digital marketing strategies, managing social media channels, and contributing to impactful campaigns that drive growth.\n\nWhat you'll be doing:\n- Assisting in the development and execution of digital marketing campaigns\n- Managing and creating content for various social media platforms\n- Analyzing performance metrics and providing insights for optimization\n- Collaborating with cross-functional teams to ensure brand consistency\n- Staying updated on industry trends and emerging digital marketing technologies\n\nWho we're looking for:\n- Enthusiastic individuals with a passion for digital marketing\n- Students or recent graduates in marketing, communications, or a related field\n- Familiarity with social media platforms and digital marketing tools\n- Strong written and verbal communication skills\n\nThis is a remote internship position with a competitive compensation of $85 per hour. If you are ready to dive into the world of digital marketing and contribute to our growth-oriented team, apply now and be a part of the exciting journey at GrowthHub Solutions PH!",
    "skill_requirements": ["Social Media"],
    "featured": true
  },
  {
    "id": 4,
    "image": "/images/data-logo-4.svg",
    "title": "Backend Development Intern",
    "company": "TechNexus Solutions Inc.",
    "location": "Metro Manila, Philippines",
    "role": "Backend Development",
    "work_setup": "Remote",
    "compensation": "Paid",
    "rate": "150/hr",
    "description": "Embark on a journey into the realm of Backend Development as a part of TechNexus Solutions Inc.'s dynamic team. Join us as a Backend Development Intern and gain hands-on experience working on innovative projects that shape the digital landscape. This is an exciting opportunity for individuals passionate about backend technologies, particularly Java.\n\nWhat you'll be doing:\n- Collaborating with our experienced backend development team\n- Writing clean and efficient code in Java\n- Contributing to the design and implementation of scalable backend systems\n- Participating in code reviews and learning from feedback\n- Troubleshooting and optimizing existing backend systems\n\nWho we're looking for:\n- Enthusiastic individuals with a passion for backend development\n- Students or recent graduates in computer science or a related field\n- Proficiency in Java programming\n- Strong problem-solving and communication skills\n\nThis is a remote internship position with a competitive compensation of $150 per hour. If you are ready to dive into the world of backend development and contribute to innovative solutions, apply now and be a part of the TechNexus Solutions Inc. family!",
    "skill_requirements": ["Java"],
    "featured": true
  },
  {
    "id": 5,
    "image": "/images/data-logo-5.svg",
    "title": "UI/UX Design Intern",
    "company": "UserXperience Solutions",
    "location": "Davao City, Philippines",
    "role": "UI/UX Design",
    "work_setup": "Onsite",
    "compensation": "Unpaid",
    "description": "Embark on a creative journey with UserXperience Solutions as a UI/UX Design Intern. Join our team in Davao City, Philippines, and immerse yourself in the fascinating world of user-centered design. This internship is a valuable opportunity for individuals aspiring to hone their skills in UI/UX design, particularly in the areas of prototyping and user research.\n\nWhat you'll be doing:\n- Collaborating with our skilled UI/UX design team on real-world projects\n- Participating in the end-to-end design process, from ideation to implementation\n- Creating interactive prototypes to visualize design concepts\n- Conducting user research to gather valuable insights\n- Assisting in usability testing and incorporating feedback into designs\n\nWho we're looking for:\n- Enthusiastic individuals with a passion for UI/UX design\n- Students or recent graduates in design, HCI, or a related field\n- Familiarity with prototyping tools and user research methodologies\n- Strong visual and communication skills\n\nPlease note that this is an onsite internship position with no monetary compensation. However, the experience gained and skills developed will be invaluable to your growth as a UI/UX designer. If you are ready to shape memorable user experiences, apply now and become a key player in defining the UserXperience Solutions of tomorrow!",
    "skill_requirements": ["Prototyping", "User Research"],
    "featured": true
  },
  {
    "id": 6,
    "image": "/images/data-logo-6.svg",
    "title": "Graphic Design Intern",
    "company": "CreatiVibe Studios",
    "location": "Cebu City, Philippines",
    "role": "Graphic Design",
    "work_setup": "Remote",
    "compensation": "Unpaid",
    "description": "Unlock your creative potential with CreatiVibe Studios as a Graphic Design Intern. Join our team remotely from Cebu City, Philippines, and delve into the world of graphic design. This internship is an exciting opportunity for individuals passionate about visual storytelling and design, with a focus on Adobe Creative Design.\n\nWhat you'll be doing:\n- Collaborating with our creative team on diverse graphic design projects\n- Crafting visually appealing designs for various mediums\n- Learning and applying design principles in real-world scenarios\n- Contributing to the development of brand identities and marketing materials\n- Gaining hands-on experience with Adobe Creative Suite\n\nWho we're looking for:\n- Enthusiastic individuals with a passion for graphic design\n- Students or recent graduates in design, visual arts, or a related field\n- Proficiency in Adobe Creative Design tools\n- Strong creativity and attention to detail\n\nPlease note that this is a remote internship position with no monetary compensation. However, the experience gained and the opportunity to work on exciting design projects will be invaluable to your growth as a graphic designer. If you are ready to bring your creativity to life, apply now and be a vital part of shaping the visual identity at CreatiVibe Studios!",
    "skill_requirements": ["Adobe Creative Design"],
    "featured": true
  },
  {
    "id": 7,
    "image": "/images/data-logo-7.svg",
    "title": "Frontend Development Intern",
    "company": "CodeCraft Innovations",
    "location": "Manila, Philippines",
    "role": "Frontend Development",
    "work_setup": "Hybrid",
    "compensation": "Paid",
    "rate": "180/hr",
    "description": "Unlock the world of frontend development with CodeCraft Innovations as a Frontend Development Intern. Join our team in Manila, Philippines, and contribute to creating visually stunning and user-friendly web interfaces. This internship is a fantastic opportunity for individuals passionate about crafting seamless user experiences.",
    "skill_requirements": ["HTML", "CSS", "JavaScript"],
    "featured": false
  },
  {
    "id": 8,
    "image": "/images/data-logo-8.svg",
    "title": "Marketing and Communications Intern",
    "company": "BrandElevate Solutions",
    "location": "Cagayan de Oro, Philippines",
    "role": "Marketing and Communications",
    "work_setup": "Remote",
    "compensation": "Unpaid",
    "description": "Join BrandElevate Solutions as a Marketing and Communications Intern and explore the dynamic world of strategic marketing and effective communications. Work remotely from Cagayan de Oro, Philippines, and be part of a team that shapes compelling brand stories and engages audiences.",
    "skill_requirements": ["Content Writing", "Social Media Management"],
    "featured": false
  },
  {
    "id": 9,
    "image": "/images/data-logo-9.svg",
    "title": "Cybersecurity Intern",
    "company": "SecureNet Dynamics",
    "location": "Iloilo City, Philippines",
    "role": "Cybersecurity",
    "work_setup": "Onsite",
    "compensation": "Paid",
    "rate": "200/hr",
    "description": "Dive into the world of cybersecurity with SecureNet Dynamics as a Cybersecurity Intern. Join our team in Iloilo City, Philippines, and contribute to safeguarding digital assets. This internship provides hands-on experience in identifying and mitigating cybersecurity threats.",
    "skill_requirements": ["Network Security", "Vulnerability Assessment"],
    "featured": false
  },
  {
    "id": 10,
    "image": "/images/data-logo-10.svg",
    "title": "AI Research Intern",
    "company": "Quantum Minds Research",
    "location": "Dumaguete City, Philippines",
    "role": "AI Research",
    "work_setup": "Remote",
    "compensation": "Paid",
    "rate": "220/hr",
    "description": "Explore the frontiers of artificial intelligence with Quantum Minds Research as an AI Research Intern. Work remotely from Dumaguete City, Philippines, and be part of a team pushing the boundaries of AI innovation. This internship involves researching and experimenting with cutting-edge AI technologies.",
    "skill_requirements": ["Machine Learning", "Deep Learning"],
    "featured": false
  },
  {
    "id": 11,
    "image": "/images/data-logo-11.svg",
    "title": "UX Research Intern",
    "company": "ExperienceCraft Labs",
    "location": "Baguio City, Philippines",
    "role": "UX Research",
    "work_setup": "Hybrid",
    "compensation": "Unpaid",
    "description": "Join ExperienceCraft Labs as a UX Research Intern and delve into the fascinating field of user experience research. This hybrid internship based in Baguio City, Philippines, offers an opportunity to contribute to understanding user behaviors and preferences to enhance digital experiences.",
    "skill_requirements": ["User Interviews", "Usability Testing"],
    "featured": false
  },
  {
    "id": 12,
    "image": "/images/data-logo-12.svg",
    "title": "Mobile App Development Intern",
    "company": "AppInnovate Tech",
    "location": "Subic Bay Freeport Zone, Philippines",
    "role": "Mobile App Development",
    "work_setup": "Remote",
    "compensation": "Paid",
    "rate": "170/hr",
    "description": "Embark on a journey into mobile app development with AppInnovate Tech as a Mobile App Development Intern. Work remotely from Subic Bay Freeport Zone, Philippines, and contribute to creating innovative and user-friendly mobile applications. This internship provides hands-on experience in building and optimizing mobile apps.",
    "skill_requirements": ["React Native", "iOS Development"],
    "featured": false
  }
]
